SKU,Name1,Name2
SKU20240425_093157_GET OFF MY ASS BEFORE I INFLATE YOUR AIRBAGS,GET OFF MY ASS BEFORE I,INFLATE YOUR AIRBAGS
SKU20240425_093158_DONT STEAL MY TOOLS I NEED THEM TO PAY YOUR BENEFITS,DON'T STEAL MY TOOLS I NEED,THEM TO PAY YOUR BENEFITS
SKU20240425_093159_NOTHING IN THIS CAR IS WORTH DYING FOR,NOTHING IN THIS CAR,IS WORTH DYING FOR
SKU20240425_093200_NOTHING IN THIS TRUCK IS WORTH DYING FOR,NOTHING IN THIS TRUCK,IS WORTH DYING FOR
SKU20240425_093201_NOTHING IN HERE IS WORTH DYING FOR,NOTHING IN HERE IS,WORTH DYING FOR
SKU20240425_093202_I BECAME A SANITATION WORKER FOR THE MONEY AND FAME,I BECAME A SANITATION,WORKER FOR THE MONEY AND FAME
SKU20240425_093203_YOU JUST GOT PASSED BY A BITCH,YOU JUST GOT,PASSED BY A BITCH
SKU20240425_093204_PLEASE BE PATIENT I HAVE CHRONIC PAIN,PLEASE BE PATIENT I,HAVE CHRONIC PAIN
SKU20240425_093205_PLEASE BE PATIENT I AM 4 YEARS OLD,PLEASE BE PATIENT I,AM 4 YEARS OLD
SKU20240425_093206_WORLDS OKAYEST CAT MUM,WORLD'S,OKAYEST CAT MUM
SKU20240425_093207_DONT STOP UNTIL YOU ARE PROUD,DONT STOP UNTIL,YOU ARE PROUD
SKU20240425_093208_JUST A GIRL WHO LOVES PICKLES,JUST A GIRL WHO,LOVES PICKLES
SKU20240425_093209_EXIT PURSUED BY A BEAR,"EXIT, PURSUED",BY A BEAR
SKU20240425_093210_EVERYONE CAN HELP SOMEONE,EVERYONE CAN,HELP SOMEONE
SKU20240425_093211_IF NOT ME WHO,IF NOT,"ME, WHO?"
SKU20240425_093212_YOU CAN NEVER HAVE TOO MANY GIRLFRIENDS,YOU CAN NEVER HAVE,TOO MANY GIRLFRIENDS
SKU20240425_093213_TIME WILL PUT YOUR ENEMIES IN THE GROUND,TIME WILL PUT YOUR,ENEMIES IN THE GROUND
SKU20240425_093214_THE BOOK WAS BETTER,THE BOOK,WAS BETTER
SKU20240425_093215_JUST A BOY WHO LOVES CHICKEN,JUST A BOY WHO,LOVES CHICKEN
SKU20240425_093216_FIRST I DRINK THE COFFEE,FIRST I DRINK,THE COFFEE
SKU20240425_093217_SHE IS CLOTHED WITH DIGNITY AND STRENGTH,SHE IS CLOTHED WITH,DIGNITY AND STRENGTH
SKU20240425_093218_I BECAME A TEMP WORKER FOR THE MONEY AND FAME,I BECAME A TEMP WORKER,FOR THE MONEY AND FAME
SKU20240425_093219_YOU CAN NEVER HAVE TOO MANY CORNETS,YOU CAN NEVER HAVE,TOO MANY CORNETS
SKU20240425_093220_WORLDS OKAYEST MEDICAL STUDENT,WORLD'S OKAYEST,MEDICAL STUDENT
SKU20240425_093221_WORLDS OKAYEST SALE REPRESENTATIVE,WORLD'S OKAYEST,SALE REPRESENTATIVE
SKU20240425_093222_LIFE IS LIKE A CAMERA,LIFE IS LIKE,A CAMERA
SKU20240425_093223_YOU HAD ME AT BOYS TO TORMENT,YOU HAD ME AT,BOYS TO TORMENT
SKU20240425_093224_YOURE SO GORGEOUS,YOU'RE SO,GORGEOUS
SKU20240425_093225_YOU AINT COOL UNLESS YOU PEE YOUR PANTS,YOU AINT COOL UNLESS,YOU PEE YOUR PANTS
SKU20240425_093226_LIFE HAPPENS COFFEE HELPS,"LIFE HAPPENS,",COFFEE HELPS
SKU20240425_093227_LET GO AND LET GOD,LET GO AND,LET GOD
SKU20240425_093228_SAVE A LIFE ADOPT A CAT,SAVE A LIFE,ADOPT A CAT
SKU20240425_093229_IVE BEEN BUSY PROCRASTINATING ALL DAY,I'VE BEEN BUSY,PROCRASTINATING ALL DAY
SKU20240425_093230_EVERYTHING IS A COPY,EVERYTHING,IS A COPY
SKU20240425_093231_I BECAME A WAREHOUSE PACKER FOR THE MONEY AND FAME,I BECAME A WAREHOUSE PACKER,FOR THE MONEY AND FAME
SKU20240425_093232_WORLDS OKAYEST FRIEND,WORLD'S,OKAYEST FRIEND
SKU20240425_093233_HE IS HALF MY SOUL,HE IS HALF,MY SOUL
SKU20240425_093234_A VERY RISKY GAMBLE,A VERY,RISKY GAMBLE
SKU20240425_093235_HONK IF YOU COMMIT ARSON,HONK IF YOU,COMMIT ARSON
SKU20240425_093236_LIVE FAST EAT TRASH SCREAM AT OWN ASS,"LIVE FAST, EAT TRASH,",SCREAM AT OWN ASS.
SKU20240425_093237_WORLDS OKAYEST GRANDPA,WORLD'S,OKAYEST GRANDPA
SKU20240425_093238_SOMETIMES SCIENCE IS MORE ART THAN SCIENCE,SOMETIMES SCIENCE IS,MORE ART THAN SCIENCE
SKU20240425_093239_IT'S NOT A PHASE IT'S WHO I AM,"IT'S NOT A PHASE,",IT'S WHO I AM
SKU20240425_093240_HONK IF YOU WANT TO BE OVERTAKEN BY MOSS,HONK IF YOU WANT TO BE,OVERTAKEN BY MOSS
SKU20240425_093242_PLEASE BE PATIENT I AM GRANDMA,PLEASE BE PATIENT,I AM GRANDMA
SKU20240425_093243_HARD WORK BEATS TALENT,HARD WORK,BEATS TALENT
SKU20240425_093244_DONT MAKE ME USE MY GRANDMA VOICE,DON'T MAKE ME USE,MY GRANDMA VOICE
SKU20240425_093245_DONT LET ANYONE MAKE YOU DISAPPEAR,DON'T LET ANYONE,MAKE YOU DISAPPEAR
SKU20240425_093246_COFFEE BECAUSE MURDER IS WRONG,COFFEE BECAUSE,MURDER IS WRONG
SKU20240425_093247_MAY WE MEET AGAIN,MAY WE,MEET AGAIN
SKU20240425_093248_WHAT I SHOULD HAVE SAID WAS NOTHING,WHAT I SHOULD HAVE,SAID WAS NOTHING
SKU20240425_093249_WORLDS OKAYEST SINGER,WORLD'S,OKAYEST SINGER
SKU20240425_093250_YOU HAVE A PLACE IN MY HEART,YOU HAVE A PLACE,IN MY HEART
